{"engineConfig":{"defaultFlushInterval":"500","datasourceConfigurations":[{"kind":"GRAPHQL","rootNodes":[{"typeName":"Guest","fieldNames":["accountId","email","name","sailings"]},{"typeName":"Query","fieldNames":["guest","sailings"]},{"typeName":"Sailing","fieldNames":["isOnBoard","sailDate","shipCode","status"]}],"overrideFieldPathFromAlias":true,"customGraphql":{"fetch":{"url":{"staticVariableContent":"http://localhost:8081/graphql"},"method":"POST","body":{},"baseUrl":{},"path":{}},"subscription":{"enabled":true,"url":{"staticVariableContent":"http://localhost:8081/graphql"},"protocol":"GRAPHQL_SUBSCRIPTION_PROTOCOL_WS","websocketSubprotocol":"GRAPHQL_WEBSOCKET_SUBPROTOCOL_AUTO"},"federation":{"enabled":true,"serviceSdl":"schema {\n  query: Query\n}\n\ntype Guest @key(fields : \"accountId\") {\n  accountId: ID!\n  email: String\n  name: String\n  sailings(first: Int, status: [SailingStatus]): [Sailing]\n}\n\ntype Query {\n  guest(accountId: ID!): Guest\n  sailings(accountId: String, first: Int, status: [SailingStatus]): [Sailing]\n}\n\ntype Sailing @key(fields : \"shipCode sailDate\") {\n  isOnBoard: Boolean!\n  sailDate: String!\n  shipCode: String!\n  status: SailingStatus!\n}\n\nenum SailingStatus {\n  ACTIVE\n  CANCELLED\n  COMPLETED\n  UPCOMING\n}"},"upstreamSchema":{"key":"7c35de38eac70a9dbf72f432d4bbbb4fc8fb3b25"}},"requestTimeoutSeconds":"10","id":"0","keys":[{"typeName":"Guest","selectionSet":"accountId"},{"typeName":"Sailing","selectionSet":"sailDate shipCode"}]},{"kind":"GRAPHQL","rootNodes":[{"typeName":"Query","fieldNames":["roomServiceCart","unifiedCartSummary"]},{"typeName":"Sailing","fieldNames":["shipCode","sailDate","status","isOnBoard","roomServiceCart"]},{"typeName":"RoomServiceCart","fieldNames":["cartId","accountId","shipCode","sailDate","stateRoom","cartType","itemCount","menuId","items","subTotalMinor","currencyCode","isPreOrder","scheduleDelivery","availability"]}],"childNodes":[{"typeName":"UnifiedCart","fieldNames":["cartId","cartType","itemCount","subTotalMinor","currencyCode","availability"]},{"typeName":"RoomServiceCartItem","fieldNames":["id","name","quantity","unitPriceMinor","totalPriceMinor","imageUrl","specialInstructions"]},{"typeName":"CartAvailability","fieldNames":["available","reason"]},{"typeName":"UnifiedCartSummary","fieldNames":["totalItemCount","totalValueMinor","currencyCode","sailings"]},{"typeName":"SailingCartSummary","fieldNames":["shipCode","sailDate","carts"]},{"typeName":"CartSummary","fieldNames":["cartType","itemCount","subtotalMinor","availability"]}],"overrideFieldPathFromAlias":true,"customGraphql":{"fetch":{"url":{"staticVariableContent":"http://localhost:8082/graphql"},"method":"POST","body":{},"baseUrl":{},"path":{}},"subscription":{"enabled":true,"url":{"staticVariableContent":"http://localhost:8082/graphql"},"protocol":"GRAPHQL_SUBSCRIPTION_PROTOCOL_WS","websocketSubprotocol":"GRAPHQL_WEBSOCKET_SUBPROTOCOL_AUTO"},"federation":{"enabled":true,"serviceSdl":"type Query {\n    roomServiceCart(accountId: ID!, shipCode: String!, sailDate: String!, itemCount: Int!, subTotalMinor: Int!): RoomServiceCart\n    unifiedCartSummary(accountId: ID!): UnifiedCartSummary\n}\n\ntype Sailing @key(fields: \"shipCode sailDate\") @extends{\n  shipCode: String @external\n  sailDate: String @external\n  status: SailingStatus!\n  isOnBoard: Boolean!\n  roomServiceCart(accountId: ID!): RoomServiceCart @requires(fields: \"shipCode sailDate\")\n}\n\nenum SailingStatus {\n  UPCOMING\n  ACTIVE\n  CANCELLED\n  COMPLETED\n}\n\ntype RoomServiceCart @key(fields: \"cartId\") {\n  cartId: ID!\n  accountId: ID!\n  shipCode: String\n  sailDate: String\n  stateRoom: String\n  cartType: UnifiedCartType! # ROOM_SERVICE\n  itemCount: Int!\n  menuId: ID\n  items: [RoomServiceCartItem!]!\n  subTotalMinor: Int!\n  currencyCode: String!\n  isPreOrder: Boolean!\n  scheduleDelivery: String\n  availability: CartAvailability!\n  #TODO for view cart: Cart!\n}\n\ninterface UnifiedCart {\n  cartId: ID!\n  cartType: UnifiedCartType!\n  itemCount: Int!\n  subTotalMinor: Int!\n  currencyCode: String!\n  availability: CartAvailability!\n}\n\ntype RoomServiceCartItem {\n  id: ID!\n  name: String!\n  quantity: Int!\n  unitPriceMinor: Int!\n  totalPriceMinor: Int!\n  imageUrl: String\n  specialInstructions: String\n}\n\nenum UnifiedCartType {\n  ROOM_SERVICE\n  COMMERCE\n  PHOTO\n  MARKETPLACE\n}\n\ntype CartAvailability {\n  available: Boolean!\n  reason: String\n  #\"Ship only\", \"Shore only\" etc.\n}\n\ntype UnifiedCartSummary {\n  totalItemCount: Int!\n  totalValueMinor: Int!\n  currencyCode: String!\n  sailings: [SailingCartSummary!]!\n}\n\ntype SailingCartSummary {\n  shipCode: String!\n  sailDate: String!\n  carts: [CartSummary!]!\n}\n\ntype CartSummary {\n  cartType: UnifiedCartType!\n  itemCount: Int!\n  subtotalMinor: Int!\n  availability: CartAvailability!\n}\n"},"upstreamSchema":{"key":"85c8d32718095b69965770588f8ecf24d07f1622"}},"requestTimeoutSeconds":"10","id":"1","keys":[{"typeName":"Sailing","selectionSet":"sailDate shipCode"},{"typeName":"RoomServiceCart","selectionSet":"cartId"}]}],"fieldConfigurations":[{"typeName":"Guest","fieldName":"sailings","argumentsConfiguration":[{"name":"first","sourceType":"FIELD_ARGUMENT"},{"name":"status","sourceType":"FIELD_ARGUMENT"}]},{"typeName":"Query","fieldName":"guest","argumentsConfiguration":[{"name":"accountId","sourceType":"FIELD_ARGUMENT"}]},{"typeName":"Query","fieldName":"sailings","argumentsConfiguration":[{"name":"accountId","sourceType":"FIELD_ARGUMENT"},{"name":"first","sourceType":"FIELD_ARGUMENT"},{"name":"status","sourceType":"FIELD_ARGUMENT"}]},{"typeName":"Query","fieldName":"roomServiceCart","argumentsConfiguration":[{"name":"accountId","sourceType":"FIELD_ARGUMENT"},{"name":"shipCode","sourceType":"FIELD_ARGUMENT"},{"name":"sailDate","sourceType":"FIELD_ARGUMENT"},{"name":"itemCount","sourceType":"FIELD_ARGUMENT"},{"name":"subTotalMinor","sourceType":"FIELD_ARGUMENT"}]},{"typeName":"Query","fieldName":"unifiedCartSummary","argumentsConfiguration":[{"name":"accountId","sourceType":"FIELD_ARGUMENT"}]},{"typeName":"Sailing","fieldName":"roomServiceCart","argumentsConfiguration":[{"name":"accountId","sourceType":"FIELD_ARGUMENT"}]}],"graphqlSchema":"schema {\n  query: Query\n}\n\ntype Guest {\n  accountId: ID!\n  email: String\n  name: String\n  sailings(first: Int, status: [SailingStatus]): [Sailing]\n}\n\ntype Query {\n  guest(accountId: ID!): Guest\n  sailings(accountId: String, first: Int, status: [SailingStatus]): [Sailing]\n  roomServiceCart(accountId: ID!, shipCode: String!, sailDate: String!, itemCount: Int!, subTotalMinor: Int!): RoomServiceCart\n  unifiedCartSummary(accountId: ID!): UnifiedCartSummary\n}\n\ntype Sailing {\n  isOnBoard: Boolean!\n  sailDate: String\n  shipCode: String\n  status: SailingStatus!\n  roomServiceCart(accountId: ID!): RoomServiceCart\n}\n\nenum SailingStatus {\n  ACTIVE\n  CANCELLED\n  COMPLETED\n  UPCOMING\n}\n\ntype RoomServiceCart {\n  cartId: ID!\n  accountId: ID!\n  shipCode: String\n  sailDate: String\n  stateRoom: String\n  cartType: UnifiedCartType!\n  itemCount: Int!\n  menuId: ID\n  items: [RoomServiceCartItem!]!\n  subTotalMinor: Int!\n  currencyCode: String!\n  isPreOrder: Boolean!\n  scheduleDelivery: String\n  availability: CartAvailability!\n}\n\ninterface UnifiedCart {\n  cartId: ID!\n  cartType: UnifiedCartType!\n  itemCount: Int!\n  subTotalMinor: Int!\n  currencyCode: String!\n  availability: CartAvailability!\n}\n\ntype RoomServiceCartItem {\n  id: ID!\n  name: String!\n  quantity: Int!\n  unitPriceMinor: Int!\n  totalPriceMinor: Int!\n  imageUrl: String\n  specialInstructions: String\n}\n\nenum UnifiedCartType {\n  ROOM_SERVICE\n  COMMERCE\n  PHOTO\n  MARKETPLACE\n}\n\ntype CartAvailability {\n  available: Boolean!\n  reason: String\n}\n\ntype UnifiedCartSummary {\n  totalItemCount: Int!\n  totalValueMinor: Int!\n  currencyCode: String!\n  sailings: [SailingCartSummary!]!\n}\n\ntype SailingCartSummary {\n  shipCode: String!\n  sailDate: String!\n  carts: [CartSummary!]!\n}\n\ntype CartSummary {\n  cartType: UnifiedCartType!\n  itemCount: Int!\n  subtotalMinor: Int!\n  availability: CartAvailability!\n}","stringStorage":{"7c35de38eac70a9dbf72f432d4bbbb4fc8fb3b25":"schema {\n  query: Query\n}\n\ndirective @key(fields: openfed__FieldSet!, resolvable: Boolean = true) repeatable on INTERFACE | OBJECT\n\ntype Guest @key(fields: \"accountId\") {\n  accountId: ID!\n  email: String\n  name: String\n  sailings(first: Int, status: [SailingStatus]): [Sailing]\n}\n\ntype Query {\n  guest(accountId: ID!): Guest\n  sailings(accountId: String, first: Int, status: [SailingStatus]): [Sailing]\n}\n\ntype Sailing @key(fields: \"shipCode sailDate\") {\n  isOnBoard: Boolean!\n  sailDate: String!\n  shipCode: String!\n  status: SailingStatus!\n}\n\nenum SailingStatus {\n  ACTIVE\n  CANCELLED\n  COMPLETED\n  UPCOMING\n}\n\nscalar openfed__FieldSet","85c8d32718095b69965770588f8ecf24d07f1622":"schema {\n  query: Query\n}\n\ndirective @extends on INTERFACE | OBJECT\n\ndirective @external on FIELD_DEFINITION | OBJECT\n\ndirective @key(fields: openfed__FieldSet!, resolvable: Boolean = true) repeatable on INTERFACE | OBJECT\n\ndirective @requires(fields: openfed__FieldSet!) on FIELD_DEFINITION\n\ntype CartAvailability {\n  available: Boolean!\n  reason: String\n}\n\ntype CartSummary {\n  availability: CartAvailability!\n  cartType: UnifiedCartType!\n  itemCount: Int!\n  subtotalMinor: Int!\n}\n\ntype Query {\n  roomServiceCart(accountId: ID!, itemCount: Int!, sailDate: String!, shipCode: String!, subTotalMinor: Int!): RoomServiceCart\n  unifiedCartSummary(accountId: ID!): UnifiedCartSummary\n}\n\ntype RoomServiceCart @key(fields: \"cartId\") {\n  accountId: ID!\n  availability: CartAvailability!\n  cartId: ID!\n  cartType: UnifiedCartType!\n  currencyCode: String!\n  isPreOrder: Boolean!\n  itemCount: Int!\n  items: [RoomServiceCartItem!]!\n  menuId: ID\n  sailDate: String\n  scheduleDelivery: String\n  shipCode: String\n  stateRoom: String\n  subTotalMinor: Int!\n}\n\ntype RoomServiceCartItem {\n  id: ID!\n  imageUrl: String\n  name: String!\n  quantity: Int!\n  specialInstructions: String\n  totalPriceMinor: Int!\n  unitPriceMinor: Int!\n}\n\ntype Sailing @key(fields: \"shipCode sailDate\") @extends {\n  isOnBoard: Boolean!\n  roomServiceCart(accountId: ID!): RoomServiceCart @requires(fields: \"shipCode sailDate\")\n  sailDate: String @external\n  shipCode: String @external\n  status: SailingStatus!\n}\n\ntype SailingCartSummary {\n  carts: [CartSummary!]!\n  sailDate: String!\n  shipCode: String!\n}\n\nenum SailingStatus {\n  ACTIVE\n  CANCELLED\n  COMPLETED\n  UPCOMING\n}\n\ninterface UnifiedCart {\n  availability: CartAvailability!\n  cartId: ID!\n  cartType: UnifiedCartType!\n  currencyCode: String!\n  itemCount: Int!\n  subTotalMinor: Int!\n}\n\ntype UnifiedCartSummary {\n  currencyCode: String!\n  sailings: [SailingCartSummary!]!\n  totalItemCount: Int!\n  totalValueMinor: Int!\n}\n\nenum UnifiedCartType {\n  COMMERCE\n  MARKETPLACE\n  PHOTO\n  ROOM_SERVICE\n}\n\nscalar openfed__FieldSet"}},"version":"00000000-0000-0000-0000-000000000000","subgraphs":[{"id":"0","name":"guest","routingUrl":"http://localhost:8081/graphql"},{"id":"1","name":"room","routingUrl":"http://localhost:8082/graphql"}],"compatibilityVersion":"1:0.49.1"}